{
  "$schema": "https://json-schema.org/draft/2020-12/schema",
  "title": "free-mem Alpha runner evidence v1",
  "type": "object",
  "additionalProperties": false,
  "required": ["runnerEvidenceVersion", "fixtureId", "fixtureFingerprint", "candidateId", "environmentFingerprint", "artifactFingerprint", "runnerId", "invocationId", "networkTrustEvidence", "resourcePlateauEvidence", "scenarios"],
  "properties": {
    "runnerEvidenceVersion": { "const": 1 },
    "fixtureId": { "$ref": "#/$defs/NonEmptyString" },
    "fixtureFingerprint": { "$ref": "#/$defs/Fingerprint" },
    "candidateId": { "$ref": "#/$defs/NonEmptyString" },
    "environmentFingerprint": { "$ref": "#/$defs/Fingerprint" },
    "artifactFingerprint": { "$ref": "#/$defs/Fingerprint" },
    "runnerId": { "const": "fixture-pinned-reference-runner-v1" },
    "invocationId": { "$ref": "#/$defs/OpaqueIdentifier" },
    "networkTrustEvidence": { "$ref": "#/$defs/NetworkTrustEvidence" },
    "resourcePlateauEvidence": {
      "oneOf": [{ "type": "null" }, { "$ref": "#/$defs/ResourcePlateauEvidence" }]
    },
    "scenarios": {
      "type": "array",
      "minItems": 1,
      "maxItems": 17,
      "items": { "$ref": "#/$defs/ScenarioEvidence" }
    }
  },
  "$defs": {
    "NonEmptyString": { "type": "string", "minLength": 1 },
    "OpaqueIdentifier": { "type": "string", "pattern": "^[A-Za-z0-9][A-Za-z0-9._:-]*$" },
    "Fingerprint": { "type": "string", "pattern": "^sha256:[0-9a-f]{64}$" },
    "NonNegativeInteger": { "type": "integer", "minimum": 0 },
    "PositiveInteger": { "type": "integer", "minimum": 1 },
    "NetworkTrustEvidence": {
      "type": "object",
      "additionalProperties": false,
      "required": ["version", "runnerInvocationId", "baseHostname", "localHostname", "repairedHostname", "publicCaSha256", "chainValidation", "hostnameValidation", "privateKeyCommitted", "tlsPreflightReceipts"],
      "properties": {
        "version": { "const": 1 },
        "runnerInvocationId": { "$ref": "#/$defs/OpaqueIdentifier" },
        "baseHostname": { "const": "summary.stub.invalid" },
        "localHostname": { "enum": ["127.0.0.1", "[::1]"] },
        "repairedHostname": { "const": "summary-repaired.stub.invalid" },
        "publicCaSha256": { "$ref": "#/$defs/Fingerprint" },
        "chainValidation": { "const": true },
        "hostnameValidation": { "const": true },
        "privateKeyCommitted": { "const": false },
        "tlsPreflightReceipts": {
          "type": "array",
          "minItems": 6,
          "maxItems": 6,
          "items": { "$ref": "#/$defs/TlsPreflightReceipt" }
        }
      }
    },
    "TlsPreflightReceipt": {
      "type": "object",
      "additionalProperties": false,
      "required": ["receiptId", "runnerInvocationId", "phase", "hostname", "sni", "port", "timeoutMs", "startMonotonicMs", "endMonotonicMs", "result", "chainValidation", "hostnameValidation", "trustAnchorSha256", "peerCertificateSha256", "credentialBytesSent", "payloadBytesSent", "httpRequestCount"],
      "properties": {
        "receiptId": { "$ref": "#/$defs/OpaqueIdentifier" },
        "runnerInvocationId": { "$ref": "#/$defs/OpaqueIdentifier" },
        "phase": { "enum": ["setup_activation", "daemon_start"] },
        "hostname": { "enum": ["summary.stub.invalid", "127.0.0.1", "[::1]", "summary-repaired.stub.invalid"] },
        "sni": { "oneOf": [
          { "type": "null" },
          { "enum": ["summary.stub.invalid", "summary-repaired.stub.invalid"] }
        ] },
        "port": { "enum": [443, 1234] },
        "timeoutMs": { "const": 5000 },
        "startMonotonicMs": { "type": "number", "minimum": 0 },
        "endMonotonicMs": { "type": "number", "minimum": 0 },
        "result": { "const": "verified" },
        "chainValidation": { "const": true },
        "hostnameValidation": { "const": true },
        "trustAnchorSha256": { "$ref": "#/$defs/Fingerprint" },
        "peerCertificateSha256": { "$ref": "#/$defs/Fingerprint" },
        "credentialBytesSent": { "const": 0 },
        "payloadBytesSent": { "const": 0 },
        "httpRequestCount": { "const": 0 }
      }
    },
    "ResourcePlateauEvidence": {
      "type": "object",
      "additionalProperties": false,
      "required": ["version", "candidateId", "artifactFingerprint", "environmentFingerprint", "runnerInvocationId", "processTreeRootId", "workload", "discardedWindowOrdinals", "measuredWindowOrdinals", "finalWindowOrdinals", "orphanProductProcessCount", "windows"],
      "properties": {
        "version": { "const": 1 },
        "candidateId": { "$ref": "#/$defs/NonEmptyString" },
        "artifactFingerprint": { "$ref": "#/$defs/Fingerprint" },
        "environmentFingerprint": { "$ref": "#/$defs/Fingerprint" },
        "runnerInvocationId": { "$ref": "#/$defs/OpaqueIdentifier" },
        "processTreeRootId": { "$ref": "#/$defs/OpaqueIdentifier" },
        "workload": { "const": "duplicate_noop_v1" },
        "discardedWindowOrdinals": { "const": [1, 2] },
        "measuredWindowOrdinals": { "const": [3, 4, 5, 6, 7, 8, 9, 10, 11, 12] },
        "finalWindowOrdinals": { "const": [8, 9, 10, 11, 12] },
        "orphanProductProcessCount": { "$ref": "#/$defs/NonNegativeInteger" },
        "windows": {
          "type": "array",
          "minItems": 12,
          "maxItems": 12,
          "items": { "$ref": "#/$defs/ResourcePlateauWindow" }
        }
      }
    },
    "ResourcePlateauWindow": {
      "type": "object",
      "additionalProperties": false,
      "required": ["ordinal", "processCount", "rssMiB", "drainedQueueDepth", "storageBytes", "selectedItemCount", "injectedTokenCount", "maxProcessingConcurrency", "drainReceiptId", "checkpointReceiptId", "workloadReceiptId", "workloadStartedMonotonicMs", "workloadReceiptMonotonicMs", "drainReceiptMonotonicMs", "checkpointReceiptMonotonicMs", "resourceSampleMonotonicMs", "duplicateDeliveryAttemptCount", "noOpOutcome", "durableMemoryDelta", "processingJobDelta"],
      "properties": {
        "ordinal": { "type": "integer", "minimum": 1, "maximum": 12 },
        "processCount": { "$ref": "#/$defs/NonNegativeInteger" },
        "rssMiB": { "type": "number", "minimum": 0 },
        "drainedQueueDepth": { "$ref": "#/$defs/NonNegativeInteger" },
        "storageBytes": { "$ref": "#/$defs/NonNegativeInteger" },
        "selectedItemCount": { "$ref": "#/$defs/NonNegativeInteger" },
        "injectedTokenCount": { "$ref": "#/$defs/NonNegativeInteger" },
        "maxProcessingConcurrency": { "$ref": "#/$defs/NonNegativeInteger" },
        "drainReceiptId": { "$ref": "#/$defs/OpaqueIdentifier" },
        "checkpointReceiptId": { "$ref": "#/$defs/OpaqueIdentifier" },
        "workloadReceiptId": { "$ref": "#/$defs/OpaqueIdentifier" },
        "workloadStartedMonotonicMs": { "type": "number", "minimum": 0 },
        "workloadReceiptMonotonicMs": { "type": "number", "minimum": 0 },
        "drainReceiptMonotonicMs": { "type": "number", "minimum": 0 },
        "checkpointReceiptMonotonicMs": { "type": "number", "minimum": 0 },
        "resourceSampleMonotonicMs": { "type": "number", "minimum": 0 },
        "duplicateDeliveryAttemptCount": { "$ref": "#/$defs/PositiveInteger" },
        "noOpOutcome": { "const": "duplicate_noop" },
        "durableMemoryDelta": { "const": 0 },
        "processingJobDelta": { "const": 0 }
      }
    },
    "HostIdentity": {
      "type": "object",
      "additionalProperties": false,
      "required": ["agent", "repositoryScope", "sessionId"],
      "properties": {
        "agent": { "enum": ["claude-code", "codex"] },
        "repositoryScope": { "$ref": "#/$defs/NonEmptyString" },
        "sessionId": { "$ref": "#/$defs/NonEmptyString" }
      }
    },
    "HostIdentityDecision": {
      "type": "object",
      "additionalProperties": false,
      "required": ["probeId", "authorityAccepted", "reason"],
      "properties": {
        "probeId": { "$ref": "#/$defs/NonEmptyString" },
        "authorityAccepted": { "const": false },
        "reason": { "const": "caller_claim_discarded" }
      }
    },
    "HostIdentityEvidence": {
      "type": "object",
      "additionalProperties": false,
      "required": ["consideredClaimCount", "claimAuthorizedPersistenceCount", "claimAuthorizedInjectionCount", "effectiveIdentity", "decisions"],
      "properties": {
        "consideredClaimCount": { "$ref": "#/$defs/PositiveInteger" },
        "claimAuthorizedPersistenceCount": { "const": 0 },
        "claimAuthorizedInjectionCount": { "const": 0 },
        "effectiveIdentity": { "$ref": "#/$defs/HostIdentity" },
        "decisions": { "type": "array", "minItems": 1, "items": { "$ref": "#/$defs/HostIdentityDecision" } }
      }
    },
    "Milestone": {
      "type": "object",
      "additionalProperties": false,
      "required": ["name", "monotonicMs"],
      "properties": {
        "name": { "$ref": "#/$defs/NonEmptyString" },
        "monotonicMs": { "type": "number", "minimum": 0 }
      }
    },
    "ProcessSample": {
      "type": "object",
      "additionalProperties": false,
      "required": ["monotonicMs", "processCount", "rssMiB", "queueDepth", "storageBytes"],
      "properties": {
        "monotonicMs": { "type": "number", "minimum": 0 },
        "processCount": { "$ref": "#/$defs/NonNegativeInteger" },
        "rssMiB": { "type": "number", "minimum": 0 },
        "queueDepth": { "$ref": "#/$defs/NonNegativeInteger" },
        "storageBytes": { "$ref": "#/$defs/NonNegativeInteger" }
      }
    },
    "RunPreparation": {
      "type": "object",
      "additionalProperties": false,
      "required": ["runOrdinal", "mode", "receiptId", "observedAtMonotonicMs", "runStartedMonotonicMs", "runFinishedMonotonicMs", "dataDirInstanceId", "processGenerationId", "observedProductProcessCount", "observedDataDirEntryCount", "readyProcessObserved"],
      "properties": {
        "runOrdinal": { "type": "integer", "minimum": 1, "maximum": 22 },
        "mode": { "enum": ["fresh_isolated_data", "fresh_namespace_on_ready_process"] },
        "receiptId": { "$ref": "#/$defs/OpaqueIdentifier" },
        "observedAtMonotonicMs": { "type": "number", "minimum": 0 },
        "runStartedMonotonicMs": { "type": "number", "minimum": 0 },
        "runFinishedMonotonicMs": { "type": "number", "minimum": 0 },
        "dataDirInstanceId": { "$ref": "#/$defs/OpaqueIdentifier" },
        "processGenerationId": { "$ref": "#/$defs/OpaqueIdentifier" },
        "observedProductProcessCount": { "$ref": "#/$defs/NonNegativeInteger" },
        "observedDataDirEntryCount": { "$ref": "#/$defs/NonNegativeInteger" },
        "readyProcessObserved": { "type": "boolean" }
      }
    },
    "ProviderEgressAuthorization": {
      "type": "object",
      "additionalProperties": false,
      "required": ["observedAtMonotonicMs", "committedEventCount", "committedEventIds", "committedEventSetFingerprint"],
      "properties": {
        "observedAtMonotonicMs": { "type": "number", "minimum": 0 },
        "committedEventCount": { "$ref": "#/$defs/NonNegativeInteger" },
        "committedEventIds": {
          "type": "array",
          "minItems": 1,
          "items": { "$ref": "#/$defs/NonEmptyString" }
        },
        "committedEventSetFingerprint": { "$ref": "#/$defs/Fingerprint" }
      }
    },
    "SourcePayloadBytesBySensitivity": {
      "type": "object",
      "additionalProperties": false,
      "required": ["eligible", "localOnly", "private", "secret"],
      "properties": {
        "eligible": { "$ref": "#/$defs/NonNegativeInteger" },
        "localOnly": { "$ref": "#/$defs/NonNegativeInteger" },
        "private": { "$ref": "#/$defs/NonNegativeInteger" },
        "secret": { "$ref": "#/$defs/NonNegativeInteger" }
      }
    },
    "ProviderEgressObserved": {
      "type": "object",
      "additionalProperties": false,
      "required": ["kind", "receiptId", "evidenceSource", "observationCaseId", "runnerInvocationId", "processTreeRootId", "providerFingerprint", "executionLocation", "observationStartedMonotonicMs", "candidateStartedMonotonicMs", "authorization", "firstProviderRequestStartedMonotonicMs", "lastProviderRequestFinishedMonotonicMs", "processTreeTerminatedMonotonicMs", "observationFinishedMonotonicMs", "preAuthorizationProviderAttemptCount", "nonLoopbackSocketAttemptCount", "providerRequestCount", "providerPayloadCount", "credentialBytesSent", "payloadBytesSent", "restrictedPayloadBytesSent", "forbiddenSentinelObservationCount", "sourcePayloadBytesBySensitivity", "redirectLocationRequestCount", "redirectLocationPayloadBytesSent", "resentPayloadCount"],
      "properties": {
        "kind": { "const": "observed" },
        "receiptId": { "$ref": "#/$defs/OpaqueIdentifier" },
        "evidenceSource": { "const": "runner_network_gate_and_stub_v1" },
        "observationCaseId": { "$ref": "#/$defs/OpaqueIdentifier" },
        "runnerInvocationId": { "$ref": "#/$defs/OpaqueIdentifier" },
        "processTreeRootId": { "$ref": "#/$defs/OpaqueIdentifier" },
        "providerFingerprint": { "$ref": "#/$defs/Fingerprint" },
        "executionLocation": { "enum": ["local", "remote"] },
        "observationStartedMonotonicMs": { "type": "number", "minimum": 0 },
        "candidateStartedMonotonicMs": { "type": "number", "minimum": 0 },
        "authorization": { "oneOf": [{ "type": "null" }, { "$ref": "#/$defs/ProviderEgressAuthorization" }] },
        "firstProviderRequestStartedMonotonicMs": { "oneOf": [{ "type": "null" }, { "type": "number", "minimum": 0 }] },
        "lastProviderRequestFinishedMonotonicMs": { "oneOf": [{ "type": "null" }, { "type": "number", "minimum": 0 }] },
        "processTreeTerminatedMonotonicMs": { "type": "number", "minimum": 0 },
        "observationFinishedMonotonicMs": { "type": "number", "minimum": 0 },
        "preAuthorizationProviderAttemptCount": { "const": 0 },
        "nonLoopbackSocketAttemptCount": { "const": 0 },
        "providerRequestCount": { "$ref": "#/$defs/NonNegativeInteger" },
        "providerPayloadCount": { "$ref": "#/$defs/NonNegativeInteger" },
        "credentialBytesSent": { "$ref": "#/$defs/NonNegativeInteger" },
        "payloadBytesSent": { "$ref": "#/$defs/NonNegativeInteger" },
        "restrictedPayloadBytesSent": { "$ref": "#/$defs/NonNegativeInteger" },
        "forbiddenSentinelObservationCount": { "$ref": "#/$defs/NonNegativeInteger" },
        "sourcePayloadBytesBySensitivity": { "$ref": "#/$defs/SourcePayloadBytesBySensitivity" },
        "redirectLocationRequestCount": { "$ref": "#/$defs/NonNegativeInteger" },
        "redirectLocationPayloadBytesSent": { "$ref": "#/$defs/NonNegativeInteger" },
        "resentPayloadCount": { "$ref": "#/$defs/NonNegativeInteger" }
      }
    },
    "ProviderEgressProjection": {
      "type": "object",
      "additionalProperties": false,
      "required": ["kind", "sourceCaseId", "sourceReceiptId"],
      "properties": {
        "kind": { "const": "projection" },
        "sourceCaseId": { "$ref": "#/$defs/OpaqueIdentifier" },
        "sourceReceiptId": { "$ref": "#/$defs/OpaqueIdentifier" }
      }
    },
    "ProviderEgressEvidence": {
      "oneOf": [
        { "$ref": "#/$defs/ProviderEgressObserved" },
        { "$ref": "#/$defs/ProviderEgressProjection" }
      ]
    },
    "RecoveryProviderEgressEvidence": {
      "type": "object",
      "additionalProperties": false,
      "required": ["caseId", "effectiveManifestFingerprint", "processTreeRootId", "evidence"],
      "properties": {
        "caseId": { "$ref": "#/$defs/NonEmptyString" },
        "effectiveManifestFingerprint": { "$ref": "#/$defs/Fingerprint" },
        "processTreeRootId": { "$ref": "#/$defs/OpaqueIdentifier" },
        "evidence": { "$ref": "#/$defs/ProviderEgressObserved" }
      }
    },
    "ScenarioEvidence": {
      "type": "object",
      "additionalProperties": false,
      "required": ["caseId", "scenarioId", "resourceSampleMode", "resourceObserverId", "processTreeRootId", "resourceDataRootId", "resultObservationFingerprint", "providerEgressEvidence", "recoveryProviderEgressEvidence", "hostIdentityEvidence", "observedMilestones", "processSamples", "latencyRuns", "runPreparations"],
      "properties": {
        "caseId": { "$ref": "#/$defs/NonEmptyString" },
        "scenarioId": { "$ref": "#/$defs/NonEmptyString" },
        "resourceSampleMode": { "enum": ["cold", "warm"] },
        "resourceObserverId": { "const": "fixture-pinned-resource-observer-v1" },
        "processTreeRootId": { "$ref": "#/$defs/OpaqueIdentifier" },
        "resourceDataRootId": { "$ref": "#/$defs/OpaqueIdentifier" },
        "resultObservationFingerprint": { "$ref": "#/$defs/Fingerprint" },
        "providerEgressEvidence": { "$ref": "#/$defs/ProviderEgressEvidence" },
        "recoveryProviderEgressEvidence": {
          "type": "array",
          "maxItems": 4,
          "items": { "$ref": "#/$defs/RecoveryProviderEgressEvidence" }
        },
        "hostIdentityEvidence": {
          "oneOf": [
            { "type": "null" },
            { "$ref": "#/$defs/HostIdentityEvidence" }
          ]
        },
        "observedMilestones": { "type": "array", "maxItems": 17, "items": { "$ref": "#/$defs/Milestone" } },
        "processSamples": { "type": "array", "minItems": 2, "maxItems": 303, "items": { "$ref": "#/$defs/ProcessSample" } },
        "latencyRuns": { "type": "array", "maxItems": 22, "items": { "$ref": "#/$defs/LatencyRun" } },
        "runPreparations": { "type": "array", "maxItems": 22, "items": { "$ref": "#/$defs/RunPreparation" } }
      }
    },
    "LatencyInterval": {
      "type": "object",
      "additionalProperties": false,
      "required": ["startMonotonicMs", "endMonotonicMs"],
      "properties": {
        "startMonotonicMs": { "type": "number", "minimum": 0 },
        "endMonotonicMs": { "type": "number", "minimum": 0 }
      }
    },
    "CaptureTiming": {
      "type": "object",
      "additionalProperties": false,
      "required": ["eventId", "startMonotonicMs", "endMonotonicMs"],
      "properties": {
        "eventId": { "$ref": "#/$defs/NonEmptyString" },
        "startMonotonicMs": { "type": "number", "minimum": 0 },
        "endMonotonicMs": { "type": "number", "minimum": 0 }
      }
    },
    "LatencyRun": {
      "type": "object",
      "additionalProperties": false,
      "required": ["runOrdinal", "discarded", "resetMode", "repositoryNamespace", "sessionNamespace", "captureTimings", "warmInjectionTiming", "coldLexicalInjectionTiming"],
      "properties": {
        "runOrdinal": { "type": "integer", "minimum": 1, "maximum": 22 },
        "discarded": { "type": "boolean" },
        "resetMode": { "enum": ["fresh_isolated_data", "fresh_namespace_on_ready_process"] },
        "repositoryNamespace": { "$ref": "#/$defs/NonEmptyString" },
        "sessionNamespace": { "$ref": "#/$defs/NonEmptyString" },
        "captureTimings": { "type": "array", "items": { "$ref": "#/$defs/CaptureTiming" } },
        "warmInjectionTiming": { "oneOf": [{ "type": "null" }, { "$ref": "#/$defs/LatencyInterval" }] },
        "coldLexicalInjectionTiming": { "oneOf": [{ "type": "null" }, { "$ref": "#/$defs/LatencyInterval" }] }
      }
    }
  }
}
