{
  "runnerEvidenceVersion": 1,
  "fixtureId": "slice1-bidirectional-en-v1",
  "fixtureFingerprint": "sha256:b36bcd7d3b2d98b629d797844beec52c57e67f5152a9297fdbaff8a58832f2e3",
  "candidateId": "candidate-example-v1",
  "environmentFingerprint": "sha256:51d1ff8bf9580085abb5f557a77382dc3d578626b14e5d0160e0b3bd4bcfa2e5",
  "artifactFingerprint": "sha256:e23cb7839a08af5b2f558c393efaf4e9af12db44c3f938106e093906e138eb0e",
  "runnerId": "fixture-pinned-reference-runner-v1",
  "invocationId": "candidate-example-v1:fixture-invocation-v1",
  "scenarios": [
    {
      "caseId": "claude-to-codex",
      "scenarioId": "claude-to-codex",
      "resourceSampleMode": "cold",
      "resourceObserverId": "fixture-pinned-resource-observer-v1",
      "processTreeRootId": "claude-to-codex:process-tree-root",
      "resourceDataRootId": "claude-to-codex:resource-data-root",
      "observedMilestones": [
        {
          "name": "source_session_started",
          "monotonicMs": 0
        },
        {
          "name": "source_events_captured",
          "monotonicMs": 100
        },
        {
          "name": "source_session_ended",
          "monotonicMs": 200
        },
        {
          "name": "target_session_started_before_source_drain",
          "monotonicMs": 300
        },
        {
          "name": "target_first_prompt_submitted_before_model",
          "monotonicMs": 400
        },
        {
          "name": "source_flush_requested_by_target_prompt",
          "monotonicMs": 500
        },
        {
          "name": "source_summary_committed",
          "monotonicMs": 600
        },
        {
          "name": "target_retrieval_requested",
          "monotonicMs": 700
        },
        {
          "name": "target_selection_started",
          "monotonicMs": 800
        },
        {
          "name": "target_selection_finished",
          "monotonicMs": 900
        },
        {
          "name": "target_injection_acknowledged",
          "monotonicMs": 1000
        },
        {
          "name": "target_model_request_dispatched",
          "monotonicMs": 1100
        },
        {
          "name": "scenario_terminal",
          "monotonicMs": 1200
        },
        {
          "name": "post_teardown_grace_elapsed",
          "monotonicMs": 1300
        }
      ],
      "processSamples": [
        {
          "monotonicMs": 0,
          "processCount": 1,
          "rssMiB": 100,
          "queueDepth": 0,
          "storageBytes": 1000
        },
        {
          "monotonicMs": 100,
          "processCount": 2,
          "rssMiB": 110,
          "queueDepth": 3,
          "storageBytes": 11000
        },
        {
          "monotonicMs": 200,
          "processCount": 2,
          "rssMiB": 110,
          "queueDepth": 3,
          "storageBytes": 11000
        },
        {
          "monotonicMs": 300,
          "processCount": 2,
          "rssMiB": 110,
          "queueDepth": 3,
          "storageBytes": 11000
        },
        {
          "monotonicMs": 400,
          "processCount": 2,
          "rssMiB": 110,
          "queueDepth": 3,
          "storageBytes": 11000
        },
        {
          "monotonicMs": 500,
          "processCount": 2,
          "rssMiB": 110,
          "queueDepth": 3,
          "storageBytes": 11000
        },
        {
          "monotonicMs": 600,
          "processCount": 2,
          "rssMiB": 110,
          "queueDepth": 3,
          "storageBytes": 11000
        },
        {
          "monotonicMs": 700,
          "processCount": 2,
          "rssMiB": 110,
          "queueDepth": 3,
          "storageBytes": 11000
        },
        {
          "monotonicMs": 800,
          "processCount": 2,
          "rssMiB": 110,
          "queueDepth": 3,
          "storageBytes": 11000
        },
        {
          "monotonicMs": 900,
          "processCount": 2,
          "rssMiB": 110,
          "queueDepth": 3,
          "storageBytes": 11000
        },
        {
          "monotonicMs": 1000,
          "processCount": 2,
          "rssMiB": 110,
          "queueDepth": 3,
          "storageBytes": 11000
        },
        {
          "monotonicMs": 1100,
          "processCount": 2,
          "rssMiB": 110,
          "queueDepth": 3,
          "storageBytes": 11000
        },
        {
          "monotonicMs": 1200,
          "processCount": 2,
          "rssMiB": 110,
          "queueDepth": 3,
          "storageBytes": 11000
        },
        {
          "monotonicMs": 1300,
          "processCount": 0,
          "rssMiB": 0,
          "queueDepth": 0,
          "storageBytes": 11000
        }
      ],
      "latencyRuns": [
        {
          "runOrdinal": 1,
          "discarded": true,
          "resetMode": "fresh_isolated_data",
          "repositoryNamespace": "claude-to-codex:repo-1",
          "sessionNamespace": "claude-to-codex:session-1",
          "captureTimings": [
            {
              "eventId": "claude-to-codex:run-1:claude-to-codex-event-1",
              "startMonotonicMs": 100000,
              "endMonotonicMs": 100100
            },
            {
              "eventId": "claude-to-codex:run-1:claude-to-codex-event-2",
              "startMonotonicMs": 101000,
              "endMonotonicMs": 101100
            },
            {
              "eventId": "claude-to-codex:run-1:claude-to-codex-event-3",
              "startMonotonicMs": 102000,
              "endMonotonicMs": 102100
            },
            {
              "eventId": "claude-to-codex:run-1:claude-to-codex-event-4",
              "startMonotonicMs": 103000,
              "endMonotonicMs": 103100
            },
            {
              "eventId": "claude-to-codex:run-1:claude-to-codex-event-5",
              "startMonotonicMs": 104000,
              "endMonotonicMs": 104100
            }
          ],
          "warmInjectionTiming": null,
          "coldLexicalInjectionTiming": {
            "startMonotonicMs": 160000,
            "endMonotonicMs": 161000
          }
        },
        {
          "runOrdinal": 2,
          "discarded": true,
          "resetMode": "fresh_isolated_data",
          "repositoryNamespace": "claude-to-codex:repo-2",
          "sessionNamespace": "claude-to-codex:session-2",
          "captureTimings": [
            {
              "eventId": "claude-to-codex:run-2:claude-to-codex-event-1",
              "startMonotonicMs": 200000,
              "endMonotonicMs": 200100
            },
            {
              "eventId": "claude-to-codex:run-2:claude-to-codex-event-2",
              "startMonotonicMs": 201000,
              "endMonotonicMs": 201100
            },
            {
              "eventId": "claude-to-codex:run-2:claude-to-codex-event-3",
              "startMonotonicMs": 202000,
              "endMonotonicMs": 202100
            },
            {
              "eventId": "claude-to-codex:run-2:claude-to-codex-event-4",
              "startMonotonicMs": 203000,
              "endMonotonicMs": 203100
            },
            {
              "eventId": "claude-to-codex:run-2:claude-to-codex-event-5",
              "startMonotonicMs": 204000,
              "endMonotonicMs": 204100
            }
          ],
          "warmInjectionTiming": null,
          "coldLexicalInjectionTiming": {
            "startMonotonicMs": 260000,
            "endMonotonicMs": 261000
          }
        },
        {
          "runOrdinal": 3,
          "discarded": false,
          "resetMode": "fresh_isolated_data",
          "repositoryNamespace": "claude-to-codex:repo-3",
          "sessionNamespace": "claude-to-codex:session-3",
          "captureTimings": [
            {
              "eventId": "claude-to-codex:run-3:claude-to-codex-event-1",
              "startMonotonicMs": 300000,
              "endMonotonicMs": 300100
            },
            {
              "eventId": "claude-to-codex:run-3:claude-to-codex-event-2",
              "startMonotonicMs": 301000,
              "endMonotonicMs": 301100
            },
            {
              "eventId": "claude-to-codex:run-3:claude-to-codex-event-3",
              "startMonotonicMs": 302000,
              "endMonotonicMs": 302100
            },
            {
              "eventId": "claude-to-codex:run-3:claude-to-codex-event-4",
              "startMonotonicMs": 303000,
              "endMonotonicMs": 303100
            },
            {
              "eventId": "claude-to-codex:run-3:claude-to-codex-event-5",
              "startMonotonicMs": 304000,
              "endMonotonicMs": 304100
            }
          ],
          "warmInjectionTiming": null,
          "coldLexicalInjectionTiming": {
            "startMonotonicMs": 360000,
            "endMonotonicMs": 361000
          }
        },
        {
          "runOrdinal": 4,
          "discarded": false,
          "resetMode": "fresh_isolated_data",
          "repositoryNamespace": "claude-to-codex:repo-4",
          "sessionNamespace": "claude-to-codex:session-4",
          "captureTimings": [
            {
              "eventId": "claude-to-codex:run-4:claude-to-codex-event-1",
              "startMonotonicMs": 400000,
              "endMonotonicMs": 400100
            },
            {
              "eventId": "claude-to-codex:run-4:claude-to-codex-event-2",
              "startMonotonicMs": 401000,
              "endMonotonicMs": 401100
            },
            {
              "eventId": "claude-to-codex:run-4:claude-to-codex-event-3",
              "startMonotonicMs": 402000,
              "endMonotonicMs": 402100
            },
            {
              "eventId": "claude-to-codex:run-4:claude-to-codex-event-4",
              "startMonotonicMs": 403000,
              "endMonotonicMs": 403100
            },
            {
              "eventId": "claude-to-codex:run-4:claude-to-codex-event-5",
              "startMonotonicMs": 404000,
              "endMonotonicMs": 404100
            }
          ],